A1: Knapp Hall Project Budget
A2: 36662
A4: Item | B4: Estimated Cost | C4: Quoted/actual cost | D4: Balance
A6: Donation | B6: 175000 | D6: =SUM(B6:C6) -> 175000
A8: Contingency of 5% | B8: =D6*0.05 -> 8750 | C8: =D6*0.05 -> 8750 | D8: =SUM(D6,-C8) -> 166250
A10: ILS furniture | B10: 19987 | C10: 19987 | D10: =SUM(D8,-C10) -> 146263
A11: ILS furniture shipping | B11: 1603 | C11: 1603 | D11: =SUM(D10,-C11) -> 144660
A12: ILS furniture installation | B12: 964 | C12: 964 | D12: =SUM(D11,-C12) -> 143696
A14: Chairs, 30 @ $125 | B14: 3750 | C14: 3750 | D14: =SUM(D12,-C14) -> 139946
A16: Remove old hung ceilings | B16: 208 | C16: 208 | D16: =SUM(D14,-C16) -> 139738
A17: New hung ceilings, paint | B17: 4476 | C17: 4476 | D17: =SUM(D16-C17) -> 135262
A18: HVAC | B18: 36157 | C18: 36157 | D18: =SUM(D17,-C18) -> 99105
A19: Electrical work for AC | B19: 2980 | C19: 2980 | D19: =SUM(D18,-C19) -> 96125
A20: Carpeting in 106 | B20: 1100 | C20: 1100 | D20: =SUM(D19,-C20) -> 95025
A22: Electrical, network, lights | B22: 11380 | C22: 11380 | D22: =SUM(D20,-C22) -> 83645
A24: Projector and screen, 105 | B24: 9260 | C24: 9260 | D24: =SUM(D22,-C24) -> 74385
A26: Projector and screen, 206 | B26: 9150 | C26: 9150 | D26: =SUM(D24,-C26) -> 65235
A28: Window blinds, both rooms | B28: 3309 | C28: 3309 | D28: =SUM(D26,-C28) -> 61926
A30: Telephones in 105, 206 | B30: $10/month/room?
A32: Software for 105
A33: SPSS, additional licensing (up to 250 installations) | B33: 3469 | C33: 3469 | D33: =SUM(D28,-C33) -> 58457
A34: Ethnograph (5 manuals) | B34: 2714 | C34: 2714 | D34: =SUM(D33,-C34) -> 55743
A35: Nvivo (only one manual) | B35: 5947 | C35: 5947 | D35: =SUM(D34,-C35) -> 49796
A36: Script writing application | B36: 1487 | C36: 1487 | D36: =SUM(D35,-C36) -> 48309
A38: Software for 206
A39: Photoshop 10 license pack | B39: 1482 | C39: 1482 | D39: =SUM(D36,-C39) -> 46827
A40: After Effects (10) | B40: 2130 | D40: =SUM(D39,-C40) -> 46827
A41: Final Cut Pro (7 of 10 bought) | B41: 2793 | C41: 2793 | D41: =SUM(D40,-C41) -> 44034
A42: Network Assistant (one only) | B42: 199 | C42: 199 | D42: =SUM(D41,-C42) -> 43835
A43: Media Cleaner, MPEG software (one each) | B43: 898 | D43: =SUM(D42,-C43) -> 43835
A44: Pro Tools LE (sound editing; 7 licenses) | B44: 3423 | D44: =SUM(D43,-C44) -> 43835
A46: Dell computers, 23 for 105 | B46: 29900 | C46: 29900 | D46: =SUM(D44,-C46) -> 13935
A47: Color scanner for 105 (scsi w/card) | B47: 499 | C47: 499 | D47: =SUM(D46,-B47) -> 13436
A48: Networked laser printer | B48: 2200 | C48: 2200 | D48: =SUM(D47,-C48) -> 11236
A50: Seven Macintosh G4, with NTSC and flat screen monitors, firewire and cables, 128 Mb RAM, 20 Gb system drive, 37 Gb drive, warranty ($6500 ea) | B50: 45500 | C50: 45500 | D50: =SUM(D48,-C50) -> -34264
A52: Color scanner for 206 | B52: 179 | C52: 179 | D52: =SUM(D50,-C52) -> -34443
A53: Networked inkjet color printer | B53: 500 | C53: 500 | D53: =SUM(D52,-C53) -> -34943
A54: Uninterruptible Power supplies (7 @ $100) | B54: 700 | C54: 700 | D54: =SUM(D53,-C54) -> -35643
A55: DV cabling, misc. | B55: 676 | C55: 676 | D55: =SUM(D54,-C55) -> -36319
A56: One Digital Camcorder, XL-1, complete | B56: 4321 | D56: =SUM(D55,-C56) -> -36319
A57: Headphones (22 @ $35) | B57: 770 | C57: 770 | D57: =SUM(D56-C57) -> -37089
A58: 7 Headphone jacks (3 into 1) | B58: 140 | C58: 140 | D58: =SUM(D57,-C58) -> -37229
A59: 1 S-Video recorder/player | B59: 1000 | D59: =SUM(D58,-C59) -> -37229
A60: 1 DAT recorder/player | B60: 1500 | D60: =SUM(D59,-C60) -> -37229
A61: 1 DVD player | B61: 350 | D61: =SUM(D60,-C61) -> -37229
A62: 1 Cart | B62: 500 | D62: =SUM(D61,-C62) -> -37229
A63: Second XL-1 camcorder | B63: 4321 | D63: =SUM(D62,-C63) -> -37229
A64: 1 Shure SM631 microphones | B64: 165 | D64: =SUM(D63,-C64) -> -37229
A65: 1 Color video monitor for cart | B65: 700 | D65: =SUM(D64,-C65) -> -37229
A68: Total estimated costs | B68: =SUM(B8:B67) -> 231537